{
  "schema_version": 1,
  "review_bundle_id": "review-bundle-v1-example",
  "dataset_id": "local-v1-example",
  "content_digest": "0000000000000000000000000000000000000000000000000000000000000000",
  "source_decision_set_digest": "4f53cda18c2baa0c0354bb5f9a3ecbe5ed12ab4d8e11ba873c2f11161202b945",
  "decision_set_digest": "4f53cda18c2baa0c0354bb5f9a3ecbe5ed12ab4d8e11ba873c2f11161202b945",
  "decisions": []
}
